{
  "schemaVersion": "larkix.requirement-brief.v1",
  "requirementId": "REQ-20260915-001",
  "title": "首页发现体验与公式推导双视图一致性修复",
  "status": "dispatched",
  "priority": "high",
  "createdAt": "2026-09-15T15:02:15.762+08:00",
  "updatedAt": "2026-09-15T15:06:16.063+08:00",
  "intent": {
    "problem": "当前首页公式卡未像搜索结果一样渲染结论公式，首页底部小程序卡片缺少统一卡片背景，首页搜索框存在冗余文字按钮且缺少清空交互，公式推导页面也缺少可直接查看公式的入口和内容。",
    "desiredOutcome": "在一个完整改动中统一首页公式、小程序卡片和搜索交互，并让公式推导页面提供可保持状态的公式/公式推导双视图，使访客能够连续查看公式及其依赖链路。",
    "targetUsers": [
      "公开访客",
      "手机端访客",
      "桌面端访客"
    ]
  },
  "scope": {
    "in": [
      "首页公式卡完整复用公开搜索结果中的公式卡展示行为：封面区域居中渲染结论公式 LaTeX，超长公式自适应缩小但不得截断，卡片下方显示公式名称和淡色所属模块，并提供明确的渲染失败兜底",
      "首页底部小程序卡片统一复用首页其他卡片的背景、圆角、边框、阴影、内边距、悬停反馈和明暗主题表现，同时保留每个小程序原有图标与文字",
      "桌面端首页底部小程序卡片同排等宽，手机端改为单列通栏",
      "首页搜索框移除原有“搜索”文字按钮，在最右侧放置可点击的搜索图标",
      "首页搜索框有文字时，在搜索图标左侧显示可点击的 X 清空按钮；清空全部内容后输入框继续保持焦点，空输入时不显示 X",
      "按 Enter 或点击搜索图标均使用当前关键词进入既有独立搜索页",
      "公式推导页面顶部提供“公式”和“公式推导”两个可切换视图",
      "从公式卡或搜索结果进入公式推导页面时默认显示“公式”，从“查看推导链路”入口进入时默认显示“公式推导”",
      "刷新页面以及浏览器后退或前进时保留当前选择的视图",
      "“公式”视图仅显示与公开搜索结果一致的当前公式单卡，不额外显示完整 Markdown 或其他详情",
      "“公式推导”视图的每个节点显示公式名称和已渲染的结论公式 LaTeX",
      "点击推导节点后切换到该节点对应公式的“公式”视图，并允许继续查看以该公式为根的推导链路",
      "没有上游依赖时，“公式推导”仍显示当前公式作为唯一根节点，并显示“暂无上游依赖”提示",
      "以上四个方面作为一个不可拆分的完整需求，由同一个新执行会话整体实现和验证"
    ],
    "out": [
      "重新设计既有独立搜索页的筛选、排序或结果卡片",
      "修改公式、文章、小程序或推导链路的数据模型与发布状态语义",
      "在公式视图中增加完整 Markdown、编辑功能或未明确要求的详情",
      "改变此前确认的浏览量、常用等级、首页聚焦内容或最新公式排序规则",
      "把本需求继续拆成多个执行包或同时分配给多个执行会话",
      "生产部署、云操作、当前或生产数据库操作、Git staging、commit 或 push"
    ]
  },
  "behavior": {
    "current": [
      "首页公式卡没有渲染结论公式，而搜索结果中的公式卡已经能够渲染。",
      "首页底部小程序卡片没有与首页其他板块保持统一的卡片背景风格。",
      "首页搜索框同时存在搜索图标和“搜索”文字按钮，缺少就地清空全部关键词的 X 控件。",
      "公式推导页面内没有公式视图，推导链路节点也没有完整呈现公式名称与渲染后的结论公式。"
    ],
    "expected": [
      "首页公式卡与搜索结果公式卡在渲染、信息层级、缩放和失败兜底上保持一致。",
      "首页底部小程序卡片在桌面、手机、白天和夜间主题下与首页卡片系统保持一致。",
      "首页搜索交互由右侧搜索图标和条件显示的 X 完成，Enter 与点击图标行为一致。",
      "公式推导页面通过顶部双视图让访客在当前公式和推导链路之间切换，并按入口决定默认视图。",
      "当前视图经过刷新和浏览器历史导航后仍保持，节点点击可以连续导航到相关公式及其链路。",
      "整个需求只交给一个新执行会话，不再进行工程拆包。"
    ],
    "edgeCases": [
      "结论公式很长、LaTeX 无效或渲染组件加载失败",
      "首页搜索框为空、只有一个字符、含前后空格或清空后立即再次输入",
      "使用键盘 Enter、鼠标点击或触屏点击搜索与清空控件",
      "直接访问公式推导 URL、从不同入口进入、刷新、后退和前进",
      "推导链路仅有根节点、存在多层节点或节点公式渲染失败",
      "桌面宽屏、窄屏手机、白天主题和夜间主题"
    ]
  },
  "acceptanceCriteria": [
    {
      "id": "ac.home-formula-parity",
      "statement": "首页每张公开公式卡均像搜索结果公式卡一样居中渲染结论公式 LaTeX，超长内容自适应缩小且不截断，并在下方显示公式名称和淡色所属模块。",
      "verification": "在桌面与手机视口对比同一公式的首页卡片和搜索结果卡片，检查公式渲染、缩放、名称、所属模块及信息顺序。"
    },
    {
      "id": "ac.home-formula-fallback",
      "statement": "公式 LaTeX 无效或渲染失败时，首页卡片显示明确可理解的兜底状态，不出现空白封面、布局崩坏或脚本错误。",
      "verification": "使用隔离测试数据或自动化夹具触发无效和超长 LaTeX，检查可见兜底、无截断和页面稳定性。"
    },
    {
      "id": "ac.miniapp-card-style",
      "statement": "首页底部小程序卡片保留原图标与文字，并统一首页卡片的背景、圆角、边框、阴影、内边距、悬停和明暗主题样式。",
      "verification": "在白天与夜间主题下对比小程序卡片和首页其他卡片的计算样式与视觉表现。"
    },
    {
      "id": "ac.miniapp-responsive",
      "statement": "小程序卡片在桌面端同排等宽，在手机端单列通栏，文字和控件不溢出。",
      "verification": "在代表性桌面与手机视口检查排列、宽度、间距和内容溢出。"
    },
    {
      "id": "ac.search-controls",
      "statement": "首页搜索框不再显示“搜索”文字按钮；最右侧搜索图标可点击，有输入时其左侧显示 X，点击 X 一次清空全部内容并保持输入焦点，空输入时 X 隐藏。",
      "verification": "使用鼠标、触屏和键盘检查控件位置、可点击区域、条件显示、一次清空及焦点保持。"
    },
    {
      "id": "ac.search-submit",
      "statement": "按 Enter 与点击搜索图标均携带当前关键词进入同一个既有独立搜索页。",
      "verification": "分别通过 Enter 和图标提交相同关键词，核对目标路由、关键词和搜索结果一致。"
    },
    {
      "id": "ac.formula-tabs-entry",
      "statement": "公式推导页面顶部显示“公式 / 公式推导”切换；从公式卡或搜索结果进入默认显示公式，从“查看推导链路”进入默认显示公式推导。",
      "verification": "逐一从规定入口进入并检查首个激活视图与顶部切换状态。"
    },
    {
      "id": "ac.formula-view",
      "statement": "公式视图只显示与搜索结果一致的当前公式单卡，不显示完整 Markdown 或未要求的详情。",
      "verification": "对比公式视图和搜索结果的同一公式卡，并确认页面未出现完整 Markdown 详情。"
    },
    {
      "id": "ac.derivation-nodes",
      "statement": "公式推导视图中每个节点均显示公式名称和渲染后的结论公式 LaTeX；点击节点切换至对应公式视图，并可继续查看以该公式为根的链路。",
      "verification": "使用包含多层依赖的公开公式逐节点点击，核对名称、LaTeX、当前公式身份和后续链路根节点。"
    },
    {
      "id": "ac.derivation-empty",
      "statement": "没有上游依赖的公式在公式推导视图中仍显示自身作为唯一根节点，并显示“暂无上游依赖”，页面不为空白。",
      "verification": "打开无依赖的已发布公式并核对唯一根节点、提示文本和非空布局。"
    },
    {
      "id": "ac.view-persistence",
      "statement": "用户选择的公式或公式推导视图在刷新以及浏览器后退/前进后保持。",
      "verification": "在两个视图分别执行刷新、跨公式导航、后退和前进，核对恢复后的活动视图。"
    },
    {
      "id": "ac.single-session",
      "statement": "本需求整体仅分配给一个新执行会话，四个方面在同一会话内完成实现、自测和交接，不产生多个并行或顺序执行包。",
      "verification": "检查 A00/派发记录仅包含一个执行会话，并核对该会话的最终 handoff 覆盖全部验收标准。"
    }
  ],
  "constraints": {
    "languages": [
      "zh-CN",
      "LaTeX"
    ],
    "platforms": [
      "LarkixMaker public homepage",
      "LarkixMaker public formula derivation page",
      "desktop browsers",
      "mobile browsers"
    ],
    "compatibility": [
      "复用既有公开搜索结果公式卡的视觉和渲染语义，不另建一套不一致的公式卡协议",
      "保留既有独立搜索页路由、筛选和搜索结果行为",
      "保留既有公式 ID、formula-ref、发布状态和推导关系语义",
      "保持白天与夜间主题兼容",
      "不得因单会话约束省略、压缩或改变任何已确认的用户行为"
    ],
    "data": [
      "只展示公开可见的公式及推导链路数据",
      "本需求不新增或迁移持久化数据字段",
      "状态保持采用实施方可安全确定的非破坏性客户端或路由机制，不改变内容数据"
    ],
    "security": [
      "不得通过公式视图或推导节点泄露草稿、归档、私有或软删除内容",
      "LaTeX 渲染与兜底继续遵守既有内容转义和安全边界"
    ],
    "operations": [
      "一个新执行会话必须整体承担本需求，禁止再次拆包或多会话并行",
      "执行会话完成后仍须经过 A00 复核才可视为完成",
      "只允许使用隔离测试数据和本地验证，不触碰当前或生产数据库",
      "不执行生产、云、部署或 Git 写入"
    ],
    "deadline": null
  },
  "evidence": [
    {
      "id": "evidence.owner-observation",
      "kind": "observation",
      "locator": "Owner request and clarification on 2026-09-15",
      "note": "Owner 报告首页公式未渲染、小程序卡片背景不统一、搜索控件冗余以及公式推导页面缺少公式，并逐项确认交互和响应式行为。",
      "status": "provided"
    },
    {
      "id": "evidence.search-card-baseline",
      "kind": "observation",
      "locator": "Existing public search-result formula card",
      "note": "Owner 指定现有搜索结果公式卡为首页公式卡和公式视图的展示基准。",
      "status": "provided"
    }
  ],
  "openQuestions": [],
  "assumptions": [],
  "risks": [
    {
      "id": "risk.shared-frontend",
      "severity": "high",
      "statement": "首页卡片、搜索控件和公式推导页可能共享前端组件或状态逻辑，局部修复容易造成另一入口回归。",
      "mitigation": "由同一执行会话统一处理并使用跨入口、跨视口、跨主题回归验证覆盖全部验收标准。"
    },
    {
      "id": "risk.history-state",
      "severity": "medium",
      "statement": "入口默认视图与刷新、浏览器历史状态保持可能互相覆盖，导致返回后视图错误。",
      "mitigation": "明确区分首次入口默认值和已有导航状态，并为直接进入、刷新、后退和前进建立独立验收场景。"
    },
    {
      "id": "risk.graph-navigation",
      "severity": "medium",
      "statement": "点击节点切换根公式后可能残留旧链路或错误加载非公开公式。",
      "mitigation": "以当前公开 formulaId 重新解析链路并验证无依赖、多层依赖及不可见节点边界。"
    },
    {
      "id": "risk.single-session-size",
      "severity": "medium",
      "statement": "单一执行会话涵盖多个公共前端表面，若缺少完整检查可能遗漏其中一项。",
      "mitigation": "保持需求不失真，要求同一 handoff 逐条提供全部验收标准的改动与验证证据，并由 A00 统一复核。"
    }
  ],
  "confirmation": {
    "confirmed": true,
    "confirmedBy": "Owner",
    "confirmedAt": "2026-09-15T15:04:00.493+08:00",
    "confirmationText": "确认\n上述需求无需拆包，直接交给一个新会话",
    "digest": "sha256:3245ca525ff7af0a418b25f88e56b1b9cd517285743259347c0eba8a74f50df9"
  },
  "dispatch": {
    "targetRole": "A00_ProjectDirector",
    "recommendedWorkbenches": [],
    "dependencies": [],
    "dispatchedAt": "2026-09-15T15:06:16.063+08:00"
  }
}
